{
  "plant_id": "trillium_erectum",
  "tier": 1,
  "supported_countries": [
    "CA",
    "FR",
    "GB",
    "IE",
    "US"
  ],
  "names": {
    "CA": [
      {
        "name": "Red trillium",
        "language": "en",
        "confidence": "high",
        "source": "linguistic",
        "citation": "Wild Adirondacks, Purple Trillium (Trillium erectum) — common names"
      },
      {
        "name": "Trille rouge",
        "language": "fr",
        "confidence": "high",
        "source": "linguistic",
        "citation": "Wikipédia (fr), Trille rouge — noms communs"
      },
      {
        "name": "Trille dressé",
        "language": "fr",
        "confidence": "medium",
        "source": "linguistic",
        "citation": "Wikipédia (fr), Trille rouge — noms communs"
      }
    ],
    "FR": [
      {
        "name": "Trille rouge",
        "language": "fr",
        "confidence": "high",
        "source": "linguistic",
        "citation": "Wikipédia (fr), Trille rouge — noms communs"
      },
      {
        "name": "Trille dressé",
        "language": "fr",
        "confidence": "medium",
        "source": "linguistic",
        "citation": "Wikipédia (fr), Trille rouge — noms communs"
      }
    ],
    "GB": [
      {
        "name": "Birthroot",
        "language": "en",
        "confidence": "high",
        "source": "commercial",
        "citation": "Royal Horticultural Society, Trillium erectum (birthroot) — common names"
      },
      {
        "name": "American shamrock",
        "language": "en",
        "confidence": "medium",
        "source": "commercial",
        "citation": "Royal Horticultural Society, Trillium erectum (birthroot) — common names"
      },
      {
        "name": "Bethroot",
        "language": "en",
        "confidence": "high",
        "source": "commercial",
        "citation": "Royal Horticultural Society, Trillium erectum (birthroot) — common names"
      },
      {
        "name": "Stinking Benjamin",
        "language": "en",
        "confidence": "medium",
        "source": "commercial",
        "citation": "Royal Horticultural Society, Trillium erectum (birthroot) — common names"
      }
    ],
    "IE": [
      {
        "name": "Birthroot",
        "language": "en",
        "confidence": "medium",
        "source": "commercial",
        "citation": "Royal Horticultural Society, Trillium erectum (birthroot) — common names"
      }
    ],
    "US": [
      {
        "name": "Red trillium",
        "language": "en",
        "confidence": "high",
        "source": "regulatory",
        "citation": "USDA Forest Service, Plant of the Week — Trillium erectum, red trillium"
      },
      {
        "name": "Purple trillium",
        "language": "en",
        "confidence": "high",
        "source": "linguistic",
        "citation": "Wild Adirondacks, Purple Trillium (Trillium erectum) — common names"
      },
      {
        "name": "Bethroot",
        "language": "en",
        "confidence": "high",
        "source": "pharmacopoeia_traditional",
        "citation": "Wild Adirondacks, Purple Trillium (Trillium erectum) — common names. Bethroot is a corruption of birthroot."
      },
      {
        "name": "Birthroot",
        "language": "en",
        "confidence": "high",
        "source": "traditional",
        "citation": "Wild Adirondacks, Purple Trillium (Trillium erectum) — common names"
      },
      {
        "name": "Wake-robin",
        "language": "en",
        "confidence": "medium",
        "source": "traditional",
        "citation": "Wild Adirondacks, Purple Trillium (Trillium erectum) — common names"
      },
      {
        "name": "Stinking Benjamin",
        "language": "en",
        "confidence": "medium",
        "source": "traditional",
        "citation": "Wild Adirondacks, Purple Trillium (Trillium erectum) — common names"
      }
    ]
  }
}
