{
  "plant_id": "anacardium_occidentale",
  "tier": 1,
  "supported_countries": ["BR", "CN", "IN", "NG", "US", "VE"],
  "names": {
    "BR": [
      {
        "name": "Caju",
        "language": "pt",
        "confidence": "high",
        "source": "ethnobotany",
        "citation": "NMPPDB; Oxford University Plants 400. Native to northeastern Brazil, used by Indigenous peoples long before European colonization; the Portuguese term derives from the Tupi name acaju, from which the English 'cashew' itself derives (via a mishearing recorded by pirate-naturalist William Dampier, 1699)"
      }
    ],
    "CN": [
      {
        "name": "\u8170\u679c",
        "language": "zh",
        "confidence": "medium",
        "source": "linguistic",
        "citation": "NMPPDB (Mandarin regional name)",
        "transliteration": "Yaoguo",
        "transliteration_scheme": "pinyin"
      }
    ],
    "IN": [
      {
        "name": "Kaju",
        "language": "hi",
        "confidence": "high",
        "source": "commercial",
        "citation": "NMPPDB. India is one of the world's largest cashew producers and processors (International Nut and Dried Fruit Council data)"
      }
    ],
    "NG": [
      {
        "name": "Kanju",
        "language": "ha",
        "confidence": "medium",
        "source": "linguistic",
        "citation": "NMPPDB (Hausa regional name); also documented as Okpokpo (Yoruba) and Akwe olu (Igbo). Nigeria is a major global cashew exporter"
      }
    ],
    "US": [
      {
        "name": "Cashew",
        "language": "en",
        "confidence": "high",
        "source": "ethnobotany",
        "citation": "Gardenia.net; Oxford University Plants 400. Name derives via English pirate-naturalist William Dampier's 1699 mishearing of Portuguese caju"
      }
    ],
    "VE": [
      {
        "name": "Merey",
        "language": "es",
        "confidence": "high",
        "source": "ethnobotany",
        "citation": "NMPPDB. Native range includes southeastern Venezuela, a center of the species' original diversity alongside northeastern Brazil"
      }
    ]
  }
}
