{
  "plant_id": "podophyllum_peltatum",
  "tier": 1,
  "supported_countries": ["AT", "AU", "BE", "CA", "CH", "DE", "FR", "GB", "IE", "NZ", "US"],
  "names": {
    "AT": [
      {
        "name": "Gewöhnlicher Maiapfel",
        "language": "de",
        "confidence": "medium",
        "source": "commercial",
        "citation": "Easyscape species database, Podophyllum peltatum common names"
      }
    ],
    "AU": [
      {
        "name": "Mayapple",
        "language": "en",
        "confidence": "medium",
        "source": "commercial",
        "citation": "Easyscape species database, Podophyllum peltatum common names"
      }
    ],
    "BE": [
      {
        "name": "Pomme de mai",
        "language": "fr",
        "confidence": "medium",
        "source": "commercial",
        "citation": "Au Jardin, Podophylle pelté, Pomme de mai, Podophyllum peltatum"
      }
    ],
    "CA": [
      {
        "name": "Mayapple",
        "language": "en",
        "confidence": "high",
        "source": "regulatory",
        "citation": "Database of Vascular Plants of Canada (VASCAN), Podophyllum peltatum"
      },
      {
        "name": "Podophylle pelté",
        "language": "fr",
        "confidence": "high",
        "source": "regulatory",
        "citation": "Database of Vascular Plants of Canada (VASCAN), Podophyllum peltatum"
      },
      {
        "name": "Pomme de mai",
        "language": "fr",
        "confidence": "high",
        "source": "traditional",
        "citation": "Flore Laurentienne, Podophyllum peltatum Linn — Podophylle pelté, Pomme de mai"
      },
      {
        "name": "Podophylle d'Amérique",
        "language": "fr",
        "confidence": "medium",
        "source": "linguistic",
        "citation": "Wikipédia (fr), Podophylle pelté — noms vernaculaires"
      }
    ],
    "CH": [
      {
        "name": "Gewöhnlicher Maiapfel",
        "language": "de",
        "confidence": "medium",
        "source": "commercial",
        "citation": "Easyscape species database, Podophyllum peltatum common names"
      },
      {
        "name": "Podophylle pelté",
        "language": "fr",
        "confidence": "medium",
        "source": "commercial",
        "citation": "Au Jardin, Podophylle pelté, Pomme de mai, Podophyllum peltatum"
      }
    ],
    "DE": [
      {
        "name": "Gewöhnlicher Maiapfel",
        "language": "de",
        "confidence": "medium",
        "source": "linguistic",
        "citation": "Easyscape species database, Podophyllum peltatum common names"
      },
      {
        "name": "Entenfuß",
        "language": "de",
        "confidence": "medium",
        "source": "linguistic",
        "citation": "Easyscape species database, Podophyllum peltatum common names"
      }
    ],
    "FR": [
      {
        "name": "Podophylle pelté",
        "language": "fr",
        "confidence": "high",
        "source": "linguistic",
        "citation": "Wikipédia (fr), Podophylle pelté — noms vernaculaires"
      },
      {
        "name": "Pomme de mai",
        "language": "fr",
        "confidence": "high",
        "source": "commercial",
        "citation": "Au Jardin, Podophylle pelté, Pomme de mai, Podophyllum peltatum"
      },
      {
        "name": "Podophylle d'Amérique",
        "language": "fr",
        "confidence": "medium",
        "source": "linguistic",
        "citation": "Wikipédia (fr), Podophylle pelté — noms vernaculaires"
      }
    ],
    "GB": [
      {
        "name": "Mayapple",
        "language": "en",
        "confidence": "high",
        "source": "commercial",
        "citation": "Easyscape species database, Podophyllum peltatum common names"
      },
      {
        "name": "American mandrake",
        "language": "en",
        "confidence": "medium",
        "source": "traditional",
        "citation": "Easyscape species database, Podophyllum peltatum common names"
      }
    ],
    "IE": [
      {
        "name": "Mayapple",
        "language": "en",
        "confidence": "medium",
        "source": "commercial",
        "citation": "Easyscape species database, Podophyllum peltatum common names"
      }
    ],
    "NZ": [
      {
        "name": "Mayapple",
        "language": "en",
        "confidence": "medium",
        "source": "commercial",
        "citation": "Easyscape species database, Podophyllum peltatum common names"
      }
    ],
    "US": [
      {
        "name": "Mayapple",
        "language": "en",
        "confidence": "high",
        "source": "regulatory",
        "citation": "Flora of North America, Podophyllum peltatum"
      },
      {
        "name": "American mandrake",
        "language": "en",
        "confidence": "high",
        "source": "traditional",
        "citation": "Wikipedia, Podophyllum peltatum — common names"
      },
      {
        "name": "Wild mandrake",
        "language": "en",
        "confidence": "medium",
        "source": "traditional",
        "citation": "Wikipedia, Podophyllum peltatum — common names"
      },
      {
        "name": "Ground lemon",
        "language": "en",
        "confidence": "medium",
        "source": "traditional",
        "citation": "Wikipedia, Podophyllum peltatum — common names"
      },
      {
        "name": "ᎤᏂᏍᏇᎫᎩ",
        "language": "chr",
        "confidence": "high",
        "source": "ethnobotany",
        "citation": "Cherokee Nation Language Program, Plants (language.cherokee.org)",
        "transliteration": "Unisquegugi",
        "transliteration_scheme": "ala_lc"
      }
    ]
  }
}
