{
  "plant_id": "sanguinaria_canadensis",
  "tier": 1,
  "supported_countries": ["AT", "AU", "BE", "CA", "CH", "CN", "DE", "DK", "FR", "GB", "IE", "JP", "NZ", "SE", "TW", "US"],
  "names": {
    "AT": [
      {
        "name": "Kanadische Blutwurz",
        "language": "de",
        "confidence": "medium",
        "source": "linguistic",
        "citation": "Zander, Handwörterbuch der Pflanzennamen"
      }
    ],
    "AU": [
      {
        "name": "Bloodroot",
        "language": "en",
        "confidence": "medium",
        "source": "commercial",
        "citation": "Missouri Botanical Garden Plant Finder, Sanguinaria canadensis"
      }
    ],
    "BE": [
      {
        "name": "Sanguinaire du Canada",
        "language": "fr",
        "confidence": "medium",
        "source": "linguistic",
        "citation": "Wikimedia Commons, Sanguinaria canadensis vernacular names"
      }
    ],
    "CA": [
      {
        "name": "Bloodroot",
        "language": "en",
        "confidence": "high",
        "source": "regulatory",
        "citation": "Québec MELCC, Espèces désignées menacées ou vulnérables"
      },
      {
        "name": "Sanguinaire du Canada",
        "language": "fr",
        "confidence": "high",
        "source": "regulatory",
        "citation": "Québec MELCC, Espèces désignées menacées ou vulnérables"
      },
      {
        "name": "Sang-dragon",
        "language": "fr",
        "confidence": "medium",
        "source": "traditional",
        "citation": "Fleurs sauvages du Québec, Sanguinaire du Canada"
      },
      {
        "name": "miskwijiibik",
        "language": "oj",
        "confidence": "medium",
        "source": "ethnobotany",
        "citation": "List of Ojibwe Plant Names (US Army Corps of Engineers regulatory docket)"
      }
    ],
    "CH": [
      {
        "name": "Kanadische Blutwurz",
        "language": "de",
        "confidence": "medium",
        "source": "commercial",
        "citation": "A.Vogel Pflanzenlexikon (CH)"
      },
      {
        "name": "Sanguinaire du Canada",
        "language": "fr",
        "confidence": "medium",
        "source": "commercial",
        "citation": "A.Vogel Encyclopédie des plantes (CH)"
      }
    ],
    "CN": [
      {
        "name": "血根草",
        "language": "zh",
        "confidence": "medium",
        "source": "linguistic",
        "citation": "Wikimedia Commons, Sanguinaria canadensis vernacular names",
        "transliteration": "Xuègēncǎo",
        "transliteration_scheme": "pinyin"
      }
    ],
    "DE": [
      {
        "name": "Kanadische Blutwurz",
        "language": "de",
        "confidence": "high",
        "source": "linguistic",
        "citation": "Zander, Handwörterbuch der Pflanzennamen"
      }
    ],
    "DK": [
      {
        "name": "Canadisk Blodurt",
        "language": "da",
        "confidence": "medium",
        "source": "linguistic",
        "citation": "Wikimedia Commons, Sanguinaria canadensis vernacular names"
      }
    ],
    "FR": [
      {
        "name": "Sanguinaire du Canada",
        "language": "fr",
        "confidence": "high",
        "source": "linguistic",
        "citation": "Wikimedia Commons, Sanguinaria canadensis vernacular names"
      }
    ],
    "GB": [
      {
        "name": "Bloodroot",
        "language": "en",
        "confidence": "high",
        "source": "commercial",
        "citation": "Missouri Botanical Garden Plant Finder, Sanguinaria canadensis"
      }
    ],
    "IE": [
      {
        "name": "Bloodroot",
        "language": "en",
        "confidence": "medium",
        "source": "commercial",
        "citation": "Missouri Botanical Garden Plant Finder, Sanguinaria canadensis"
      }
    ],
    "JP": [
      {
        "name": "カナダケシ",
        "language": "ja",
        "confidence": "medium",
        "source": "linguistic",
        "citation": "Wikimedia Commons, Sanguinaria canadensis vernacular names",
        "transliteration": "Kanadakeshi",
        "transliteration_scheme": "hepburn"
      }
    ],
    "NZ": [
      {
        "name": "Bloodroot",
        "language": "en",
        "confidence": "medium",
        "source": "commercial",
        "citation": "Missouri Botanical Garden Plant Finder, Sanguinaria canadensis"
      }
    ],
    "SE": [
      {
        "name": "Blodört",
        "language": "sv",
        "confidence": "medium",
        "source": "linguistic",
        "citation": "Wikimedia Commons, Sanguinaria canadensis vernacular names"
      }
    ],
    "TW": [
      {
        "name": "血根草",
        "language": "zh",
        "confidence": "medium",
        "source": "linguistic",
        "citation": "Wikimedia Commons, Sanguinaria canadensis vernacular names",
        "transliteration": "Xuègēncǎo",
        "transliteration_scheme": "pinyin"
      }
    ],
    "US": [
      {
        "name": "Bloodroot",
        "language": "en",
        "confidence": "high",
        "source": "pharmacopoeia_traditional",
        "citation": "USDA Forest Service, Bloodroot (Sanguinaria canadensis): an annotated bibliography"
      },
      {
        "name": "Bloodwort",
        "language": "en",
        "confidence": "medium",
        "source": "traditional",
        "citation": "University of Wisconsin Extension Horticulture, Bloodroot"
      },
      {
        "name": "Red puccoon",
        "language": "en",
        "confidence": "medium",
        "source": "traditional",
        "citation": "University of Wisconsin Extension Horticulture, Bloodroot"
      },
      {
        "name": "ᎩᎵ ᎤᏩᏘ",
        "language": "chr",
        "confidence": "high",
        "source": "ethnobotany",
        "citation": "Cherokee Nation Language Program, Plants (language.cherokee.org)",
        "transliteration": "Gili Uwati",
        "transliteration_scheme": "ala_lc"
      },
      {
        "name": "miskwijiibik",
        "language": "oj",
        "confidence": "medium",
        "source": "ethnobotany",
        "citation": "List of Ojibwe Plant Names (US Army Corps of Engineers regulatory docket)"
      }
    ]
  }
}
