{
  "plant_id": "chimaphila_umbellata",
  "tier": 1,
  "supported_countries": [
    "AT",
    "CA",
    "CH",
    "CZ",
    "DE",
    "DK",
    "FI",
    "FR",
    "GB",
    "NO",
    "US"
  ],
  "names": {
    "AT": [
      {
        "name": "Doldiges Winterlieb",
        "language": "de",
        "confidence": "high",
        "source": "linguistic",
        "citation": "GBIF species 2888307, Chimaphila umbellata — vernacular names (German)"
      },
      {
        "name": "Winterlieb",
        "language": "de",
        "confidence": "high",
        "source": "linguistic",
        "citation": "GBIF species 2888307, Chimaphila umbellata — vernacular names (German)"
      },
      {
        "name": "Harn-Gichtkraut",
        "language": "de",
        "confidence": "medium",
        "source": "traditional",
        "citation": "Yarnell, Chimaphila umbellata monograph (botmed.rocks) — common names by language (German)"
      }
    ],
    "CA": [
      {
        "name": "Pipsissewa",
        "language": "en",
        "confidence": "high",
        "source": "ethnobotany",
        "citation": "Yarnell, Chimaphila umbellata monograph (botmed.rocks) — common names by language (English). The name is Cree-Montagnais-Naskapi in origin."
      },
      {
        "name": "Prince's pine",
        "language": "en",
        "confidence": "high",
        "source": "linguistic",
        "citation": "GBIF species 2888307, Chimaphila umbellata — vernacular names (English)"
      },
      {
        "name": "Pyrole en ombelle",
        "language": "fr",
        "confidence": "high",
        "source": "linguistic",
        "citation": "GBIF species 2888307, Chimaphila umbellata — vernacular names (French)"
      },
      {
        "name": "ga'gige'bug",
        "language": "oj",
        "confidence": "medium",
        "source": "ethnobotany",
        "citation": "Yarnell, Chimaphila umbellata monograph (botmed.rocks) — common names by language — Anishinaabemowin (Ojibwe) name, glossed 'everlasting leaf'"
      }
    ],
    "CH": [
      {
        "name": "Doldiges Winterlieb",
        "language": "de",
        "confidence": "high",
        "source": "linguistic",
        "citation": "GBIF species 2888307, Chimaphila umbellata — vernacular names (German)"
      },
      {
        "name": "Pyrole en ombelle",
        "language": "fr",
        "confidence": "high",
        "source": "linguistic",
        "citation": "GBIF species 2888307, Chimaphila umbellata — vernacular names (French)"
      }
    ],
    "CZ": [
      {
        "name": "Zimozelen okoličnatý",
        "language": "cs",
        "confidence": "medium",
        "source": "linguistic",
        "citation": "Yarnell, Chimaphila umbellata monograph (botmed.rocks) — common names by language (Czech)"
      }
    ],
    "DE": [
      {
        "name": "Doldiges Winterlieb",
        "language": "de",
        "confidence": "high",
        "source": "linguistic",
        "citation": "GBIF species 2888307, Chimaphila umbellata — vernacular names (German)"
      },
      {
        "name": "Winterlieb",
        "language": "de",
        "confidence": "high",
        "source": "linguistic",
        "citation": "GBIF species 2888307, Chimaphila umbellata — vernacular names (German)"
      },
      {
        "name": "Harn-Gichtkraut",
        "language": "de",
        "confidence": "medium",
        "source": "traditional",
        "citation": "Yarnell, Chimaphila umbellata monograph (botmed.rocks) — common names by language (German)"
      }
    ],
    "DK": [
      {
        "name": "Skærm-vintergrøn",
        "language": "da",
        "confidence": "high",
        "source": "linguistic",
        "citation": "GBIF species 2888307, Chimaphila umbellata — vernacular names (Danish)"
      },
      {
        "name": "Skærmblomstret vintergrøn",
        "language": "da",
        "confidence": "medium",
        "source": "linguistic",
        "citation": "GBIF species 2888307, Chimaphila umbellata — vernacular names (Danish)"
      }
    ],
    "FI": [
      {
        "name": "Sarjatalvikki",
        "language": "fi",
        "confidence": "medium",
        "source": "linguistic",
        "citation": "Yarnell, Chimaphila umbellata monograph (botmed.rocks) — common names by language (Finnish)"
      },
      {
        "name": "Kangassarjatalvikki",
        "language": "fi",
        "confidence": "medium",
        "source": "linguistic",
        "citation": "Yarnell, Chimaphila umbellata monograph (botmed.rocks) — common names by language (Finnish)"
      }
    ],
    "FR": [
      {
        "name": "Pyrole en ombelle",
        "language": "fr",
        "confidence": "high",
        "source": "linguistic",
        "citation": "GBIF species 2888307, Chimaphila umbellata — vernacular names (French)"
      },
      {
        "name": "Chimaphile à ombelles",
        "language": "fr",
        "confidence": "high",
        "source": "linguistic",
        "citation": "GBIF species 2888307, Chimaphila umbellata — vernacular names (French)"
      },
      {
        "name": "Herbe à pisser",
        "language": "fr",
        "confidence": "medium",
        "source": "traditional",
        "citation": "Yarnell, Chimaphila umbellata monograph (botmed.rocks) — common names by language (French)"
      }
    ],
    "GB": [
      {
        "name": "Umbellate wintergreen",
        "language": "en",
        "confidence": "high",
        "source": "linguistic",
        "citation": "GBIF species 2888307, Chimaphila umbellata — vernacular names (English)"
      },
      {
        "name": "Pipsissewa",
        "language": "en",
        "confidence": "medium",
        "source": "commercial",
        "citation": "GBIF species 2888307, Chimaphila umbellata — vernacular names (English)"
      }
    ],
    "NO": [
      {
        "name": "Bittergrønn",
        "language": "no",
        "confidence": "high",
        "source": "linguistic",
        "citation": "GBIF species 2888307, Chimaphila umbellata — vernacular names (Norwegian Bokmål)"
      },
      {
        "name": "Bittergrøn",
        "language": "nn",
        "confidence": "medium",
        "source": "linguistic",
        "citation": "GBIF species 2888307, Chimaphila umbellata — vernacular names (Norwegian Nynorsk)"
      }
    ],
    "US": [
      {
        "name": "Pipsissewa",
        "language": "en",
        "confidence": "high",
        "source": "pharmacopoeia_traditional",
        "citation": "Yarnell, Chimaphila umbellata monograph (botmed.rocks) — common names by language (English). Formerly official in the United States Pharmacopeia."
      },
      {
        "name": "Prince's pine",
        "language": "en",
        "confidence": "high",
        "source": "linguistic",
        "citation": "GBIF species 2888307, Chimaphila umbellata — vernacular names (English)"
      },
      {
        "name": "Ground holly",
        "language": "en",
        "confidence": "medium",
        "source": "traditional",
        "citation": "Yarnell, Chimaphila umbellata monograph (botmed.rocks) — common names by language (English)"
      },
      {
        "name": "King's cure",
        "language": "en",
        "confidence": "medium",
        "source": "traditional",
        "citation": "Yarnell, Chimaphila umbellata monograph (botmed.rocks) — common names by language (English)"
      },
      {
        "name": "ga'gige'bug",
        "language": "oj",
        "confidence": "medium",
        "source": "ethnobotany",
        "citation": "Yarnell, Chimaphila umbellata monograph (botmed.rocks) — common names by language — Anishinaabemowin (Ojibwe) name, glossed 'everlasting leaf'"
      }
    ]
  }
}
