{
  "plant_id": "geranium_maculatum",
  "tier": 1,
  "supported_countries": ["CA", "US"],
  "names": {
    "CA": [
      {
        "name": "Wild geranium",
        "language": "en",
        "confidence": "high",
        "source": "ethnobotany",
        "citation": "Wikipedia; native range confirmed to include southern Manitoba and southwestern Quebec. True Geranium genus, distinct from the South African Pelargonium (common garden/bedding 'geranium'); also distinct from 'wood cranesbill'/'woodland geranium', which properly refers to the European Geranium sylvaticum"
      }
    ],
    "US": [
      {
        "name": "Wild geranium",
        "language": "en",
        "confidence": "high",
        "source": "ethnobotany",
        "citation": "US Forest Service Plant of the Week; NC Extension Gardener Plant Toolbox; UMass Extension. Virginia Native Plant Society's 2020 Wildflower of the Year"
      }
    ]
  }
}
